{
  "controlSchema": "repository-evidence-manifest.schema.json",
  "recordId": "EVM-UNINSTANTIATED",
  "recordType": "REPOSITORY_EVIDENCE_MANIFEST",
  "schemaVersion": "0.3.0",
  "programInstanceId": "IRP-UNINSTANTIATED",
  "version": "0.1.0",
  "status": "DRAFT",
  "createdAt": "2026-07-19T15:54:56Z",
  "createdBy": "UNASSIGNED",
  "repositoryRevision": "UNASSESSED",
  "worktreeState": "UNASSESSED",
  "toolchain": {},
  "evidenceItems": [],
  "excludedEvidence": []
}
